[2025-11-29 17:27:26] [INFO] Plotting accuracy plot
[2025-11-29 17:27:27] [INFO]         accuracy
count  15.000000
mean    0.735895
std     0.086924
min     0.545752
25%     0.716503
50%     0.758170
75%     0.792908
max     0.849673
[2025-11-29 17:27:27] [INFO] Plotting confusion matrix
[2025-11-29 17:27:27] [INFO] Confusion matrix plot saved to results/images/cm.png
[2025-11-29 17:27:27] [INFO] Confusion matrix data:
        Overt  Covert  Rest
Overt    1918     163   113
Covert    218    1733   244
Rest      340     622  1233
[2025-11-29 17:27:27] [INFO] Plotting metrics
[2025-11-29 17:27:27] [INFO] Metrics plot saved to results/images/overt_covert_rest_metrics.pdf
[2025-11-29 17:27:27] [INFO] Metrics summary per subject:
   subject_id  precision    recall        f1
0          01   0.835320  0.761438  0.734893
1          02   0.647195  0.565359  0.558331
2          03   0.862378  0.849673  0.845757
3          04   0.817008  0.779412  0.770917
4          05   0.746934  0.735294  0.732353
5          06   0.758285  0.758170  0.753551
6          07   0.553001  0.545752  0.539813
7          08   0.829866  0.807190  0.807960
8          09   0.733758  0.730392  0.731000
9          10   0.684718  0.660131  0.644908
10         11   0.702707  0.702614  0.693793
11         12   0.787174  0.750000  0.734394
12         13   0.803208  0.772876  0.760521
13         14   0.817121  0.813725  0.814186
14         15   0.838887  0.806404  0.801630
[2025-11-29 17:27:27] [INFO] Class-wise precision:
class_id
0    0.798960
1    0.706437
2    0.799540
Name: precision, dtype: float64
[2025-11-29 17:27:27] [INFO] Class-wise recall:
class_id
0    0.875291
1    0.789998
2    0.567181
Name: recall, dtype: float64
[2025-11-29 17:27:27] [INFO] Class-wise F1 score:
class_id
0    0.828454
1    0.734290
2    0.647524
Name: f1, dtype: float64
[2025-11-29 17:27:27] [INFO] Class-wise precision standard deviation:
class_id
0    0.141413
1    0.094134
2    0.147519
Name: precision, dtype: float64
[2025-11-29 17:27:27] [INFO] Class-wise recall standard deviation:
class_id
0    0.113485
1    0.150644
2    0.160616
Name: recall, dtype: float64
[2025-11-29 17:27:27] [INFO] Class-wise F1 score standard deviation:
class_id
0    0.116297
1    0.085515
2    0.125906
Name: f1, dtype: float64
[2025-11-29 17:32:59] [INFO] Plotting accuracy plot
[2025-11-29 17:33:00] [INFO]    subject_id  accuracy
0          01  0.761438
1          02  0.565359
2          03  0.849673
3          04  0.779412
4          05  0.735294
5          06  0.758170
6          07  0.545752
7          08  0.807190
8          09  0.730392
9          10  0.660131
10         11  0.702614
11         12  0.750000
12         13  0.772876
13         14  0.813725
14         15  0.806404
[2025-11-29 17:33:00] [INFO]         accuracy
count  15.000000
mean    0.735895
std     0.086924
min     0.545752
25%     0.716503
50%     0.758170
75%     0.792908
max     0.849673
[2025-11-29 17:33:00] [INFO] Plotting confusion matrix
[2025-11-29 17:33:00] [INFO] Confusion matrix plot saved to results/images/cm.png
[2025-11-29 17:33:00] [INFO] Confusion matrix data:
        Overt  Covert  Rest
Overt    1918     163   113
Covert    218    1733   244
Rest      340     622  1233
[2025-11-29 17:33:00] [INFO] Plotting metrics
[2025-11-29 17:33:00] [INFO] Metrics plot saved to results/images/overt_covert_rest_metrics.pdf
[2025-11-29 17:33:00] [INFO] Metrics summary per subject:
   subject_id  precision    recall        f1
0          01   0.835320  0.761438  0.734893
1          02   0.647195  0.565359  0.558331
2          03   0.862378  0.849673  0.845757
3          04   0.817008  0.779412  0.770917
4          05   0.746934  0.735294  0.732353
5          06   0.758285  0.758170  0.753551
6          07   0.553001  0.545752  0.539813
7          08   0.829866  0.807190  0.807960
8          09   0.733758  0.730392  0.731000
9          10   0.684718  0.660131  0.644908
10         11   0.702707  0.702614  0.693793
11         12   0.787174  0.750000  0.734394
12         13   0.803208  0.772876  0.760521
13         14   0.817121  0.813725  0.814186
14         15   0.838887  0.806404  0.801630
[2025-11-29 17:33:00] [INFO] Class-wise precision:
class_id
0    0.798960
1    0.706437
2    0.799540
Name: precision, dtype: float64
[2025-11-29 17:33:00] [INFO] Class-wise recall:
class_id
0    0.875291
1    0.789998
2    0.567181
Name: recall, dtype: float64
[2025-11-29 17:33:00] [INFO] Class-wise F1 score:
class_id
0    0.828454
1    0.734290
2    0.647524
Name: f1, dtype: float64
[2025-11-29 17:33:00] [INFO] Class-wise precision standard deviation:
class_id
0    0.141413
1    0.094134
2    0.147519
Name: precision, dtype: float64
[2025-11-29 17:33:00] [INFO] Class-wise recall standard deviation:
class_id
0    0.113485
1    0.150644
2    0.160616
Name: recall, dtype: float64
[2025-11-29 17:33:00] [INFO] Class-wise F1 score standard deviation:
class_id
0    0.116297
1    0.085515
2    0.125906
Name: f1, dtype: float64
[2025-11-29 17:50:34] [INFO] Plotting accuracy plot
[2025-11-29 17:50:34] [INFO]    subject_id  accuracy
0          01  0.761438
1          02  0.565359
2          03  0.849673
3          04  0.779412
4          05  0.735294
5          06  0.758170
6          07  0.545752
7          08  0.807190
8          09  0.730392
9          10  0.660131
10         11  0.702614
11         12  0.750000
12         13  0.772876
13         14  0.813725
14         15  0.806404
[2025-11-29 17:50:34] [INFO]         accuracy
count  15.000000
mean    0.735895
std     0.086924
min     0.545752
25%     0.716503
50%     0.758170
75%     0.792908
max     0.849673
[2025-11-29 17:50:34] [INFO] Plotting confusion matrix
[2025-11-29 17:50:34] [INFO] Confusion matrix plot saved to results/images/cm.png
[2025-11-29 17:50:34] [INFO] Confusion matrix data:
        Overt  Covert  Rest
Overt    1918     163   113
Covert    218    1733   244
Rest      340     622  1233
[2025-11-29 17:50:34] [INFO] Plotting metrics
[2025-11-29 17:50:34] [INFO] Metrics plot saved to results/images/overt_covert_rest_metrics.pdf
[2025-11-29 17:50:34] [INFO] Metrics summary per subject:
   subject_id  precision    recall        f1
0          01   0.835320  0.761438  0.734893
1          02   0.647195  0.565359  0.558331
2          03   0.862378  0.849673  0.845757
3          04   0.817008  0.779412  0.770917
4          05   0.746934  0.735294  0.732353
5          06   0.758285  0.758170  0.753551
6          07   0.553001  0.545752  0.539813
7          08   0.829866  0.807190  0.807960
8          09   0.733758  0.730392  0.731000
9          10   0.684718  0.660131  0.644908
10         11   0.702707  0.702614  0.693793
11         12   0.787174  0.750000  0.734394
12         13   0.803208  0.772876  0.760521
13         14   0.817121  0.813725  0.814186
14         15   0.838887  0.806404  0.801630
[2025-11-29 17:50:34] [INFO] Class-wise precision:
class_id
0    0.798960
1    0.706437
2    0.799540
Name: precision, dtype: float64
[2025-11-29 17:50:34] [INFO] Class-wise recall:
class_id
0    0.875291
1    0.789998
2    0.567181
Name: recall, dtype: float64
[2025-11-29 17:50:34] [INFO] Class-wise F1 score:
class_id
0    0.828454
1    0.734290
2    0.647524
Name: f1, dtype: float64
[2025-11-29 17:50:34] [INFO] Class-wise precision standard deviation:
class_id
0    0.141413
1    0.094134
2    0.147519
Name: precision, dtype: float64
[2025-11-29 17:50:34] [INFO] Class-wise recall standard deviation:
class_id
0    0.113485
1    0.150644
2    0.160616
Name: recall, dtype: float64
[2025-11-29 17:50:34] [INFO] Class-wise F1 score standard deviation:
class_id
0    0.116297
1    0.085515
2    0.125906
Name: f1, dtype: float64
[2025-11-29 17:52:51] [INFO] Plotting Peak and Mean amplitudes for visual and no visual conditions
[2025-11-29 17:52:51] [INFO] T-test (Peak): t=-5.667, p=1.451e-04
[2025-11-29 17:52:51] [INFO] T-test (Mean): t=-5.153, p=3.167e-04
[2025-11-29 17:52:51] [INFO] Visual
[2025-11-29 17:52:51] [INFO]             mean       peak
count  12.000000  12.000000
mean    1.500687   6.228459
std     2.010356   4.201298
min    -0.997938   1.904598
25%    -0.464203   2.548239
50%     1.127450   5.018815
75%     2.765352   8.983492
max     4.809683  14.271441
[2025-11-29 17:52:51] [INFO] No visual Change
[2025-11-29 17:52:51] [INFO]             mean       peak
count  13.000000  13.000000
mean   -2.265242  -0.809167
std     1.160746   1.349747
min    -4.798824  -3.090288
25%    -2.685027  -1.657878
50%    -2.183520  -0.909303
75%    -1.780338  -0.340571
max    -0.054225   1.477331
[2025-11-29 17:52:51] [INFO] Plot saved to results/images/peakMeanAmplitudeVisualRest.pdf
[2025-11-29 17:52:51] [INFO] Starting Grand ERP Rest Visualization
[2025-11-29 17:52:51] [INFO] ************************************************************
[2025-11-29 17:52:51] [INFO] **********P100 Pipeline sub-01, ses-01**********
[2025-11-29 17:52:51] [INFO] ************************************************************
[2025-11-29 17:52:51] [INFO] ************************************************************
[2025-11-29 17:52:51] [INFO] **********Initializing BIDSDatasetReader**********
[2025-11-29 17:52:51] [INFO] ************************************************************
[2025-11-29 17:52:51] [INFO] Processed EEG file exists. Loading...
[2025-11-29 17:52:51] [INFO] Loading processed EEG from BIDS/derivatives/low-0.1_high-40.0_ICA-True/sub-01_ses-01_processed.fif
[2025-11-29 17:52:54] [INFO] Creating epochs for condition: Visual
[2025-11-29 17:52:54] [INFO] ************************************************************
[2025-11-29 17:52:54] [INFO] **********Initializing Epoch Builder**********
[2025-11-29 17:52:54] [INFO] ************************************************************
[2025-11-29 17:52:54] [INFO] Creating Epochs
[2025-11-29 17:52:55] [INFO] Creating epochs for condition: No Visual Change
[2025-11-29 17:52:55] [INFO] ************************************************************
[2025-11-29 17:52:55] [INFO] **********Initializing Epoch Builder**********
[2025-11-29 17:52:55] [INFO] ************************************************************
[2025-11-29 17:52:55] [INFO] Creating Epochs
[2025-11-29 17:52:55] [INFO] ************************************************************
[2025-11-29 17:52:55] [INFO] **********Initializing P100ComponentAnalyzer**********
[2025-11-29 17:52:55] [INFO] ************************************************************
[2025-11-29 17:52:55] [INFO] Caculating Latency, peak and mean
[2025-11-29 17:52:55] [INFO] Latency: 0.112, Peak: 2.429672841435669, Mean: -0.44830447498719145
[2025-11-29 17:52:55] [INFO] ************************************************************
[2025-11-29 17:52:55] [INFO] **********Initializing P100ComponentAnalyzer**********
[2025-11-29 17:52:55] [INFO] ************************************************************
[2025-11-29 17:52:55] [INFO] Caculating Latency, peak and mean
[2025-11-29 17:52:55] [INFO] Latency: 0.12, Peak: -1.7244383060930568, Mean: -2.705278882074789
[2025-11-29 17:52:55] [INFO] ************************************************************
[2025-11-29 17:52:55] [INFO] **********P100 Pipeline sub-02, ses-01**********
[2025-11-29 17:52:55] [INFO] ************************************************************
[2025-11-29 17:52:55] [INFO] ************************************************************
[2025-11-29 17:52:55] [INFO] **********Initializing BIDSDatasetReader**********
[2025-11-29 17:52:55] [INFO] ************************************************************
[2025-11-29 17:52:55] [INFO] Processed EEG file exists. Loading...
[2025-11-29 17:52:55] [INFO] Loading processed EEG from BIDS/derivatives/low-0.1_high-40.0_ICA-True/sub-02_ses-01_processed.fif
[2025-11-29 17:52:58] [INFO] Creating epochs for condition: Visual
[2025-11-29 17:52:58] [INFO] ************************************************************
[2025-11-29 17:52:58] [INFO] **********Initializing Epoch Builder**********
[2025-11-29 17:52:58] [INFO] ************************************************************
[2025-11-29 17:52:58] [INFO] Creating Epochs
[2025-11-29 17:52:58] [INFO] Creating epochs for condition: No Visual Change
[2025-11-29 17:52:58] [INFO] ************************************************************
[2025-11-29 17:52:58] [INFO] **********Initializing Epoch Builder**********
[2025-11-29 17:52:58] [INFO] ************************************************************
[2025-11-29 17:52:58] [INFO] Creating Epochs
[2025-11-29 17:52:58] [INFO] ************************************************************
[2025-11-29 17:52:58] [INFO] **********Initializing P100ComponentAnalyzer**********
[2025-11-29 17:52:58] [INFO] ************************************************************
[2025-11-29 17:52:58] [INFO] Caculating Latency, peak and mean
[2025-11-29 17:52:58] [INFO] Latency: 0.12, Peak: 4.74458102502099, Mean: 0.9478782237973854
[2025-11-29 17:52:58] [INFO] ************************************************************
[2025-11-29 17:52:58] [INFO] **********Initializing P100ComponentAnalyzer**********
[2025-11-29 17:52:58] [INFO] ************************************************************
[2025-11-29 17:52:58] [INFO] Caculating Latency, peak and mean
[2025-11-29 17:52:58] [INFO] Latency: 0.12, Peak: -1.7043643390607108, Mean: -2.090905637979808
[2025-11-29 17:52:58] [INFO] ************************************************************
[2025-11-29 17:52:58] [INFO] **********P100 Pipeline sub-03, ses-01**********
[2025-11-29 17:52:58] [INFO] ************************************************************
[2025-11-29 17:52:58] [INFO] ************************************************************
[2025-11-29 17:52:58] [INFO] **********Initializing BIDSDatasetReader**********
[2025-11-29 17:52:58] [INFO] ************************************************************
[2025-11-29 17:52:58] [INFO] Processed EEG file exists. Loading...
[2025-11-29 17:52:58] [INFO] Loading processed EEG from BIDS/derivatives/low-0.1_high-40.0_ICA-True/sub-03_ses-01_processed.fif
[2025-11-29 17:53:00] [INFO] Creating epochs for condition: Visual
[2025-11-29 17:53:00] [INFO] ************************************************************
[2025-11-29 17:53:00] [INFO] **********Initializing Epoch Builder**********
[2025-11-29 17:53:00] [INFO] ************************************************************
[2025-11-29 17:53:00] [INFO] Creating Epochs
[2025-11-29 17:53:00] [INFO] Creating epochs for condition: No Visual Change
[2025-11-29 17:53:00] [INFO] ************************************************************
[2025-11-29 17:53:00] [INFO] **********Initializing Epoch Builder**********
[2025-11-29 17:53:00] [INFO] ************************************************************
[2025-11-29 17:53:00] [INFO] Creating Epochs
[2025-11-29 17:53:00] [INFO] ************************************************************
[2025-11-29 17:53:00] [INFO] **********Initializing P100ComponentAnalyzer**********
[2025-11-29 17:53:00] [INFO] ************************************************************
[2025-11-29 17:53:00] [INFO] Caculating Latency, peak and mean
[2025-11-29 17:53:00] [INFO] Latency: 0.11, Peak: 10.516089977044627, Mean: 6.588676367499004
[2025-11-29 17:53:00] [INFO] ************************************************************
[2025-11-29 17:53:00] [INFO] **********Initializing P100ComponentAnalyzer**********
[2025-11-29 17:53:00] [INFO] ************************************************************
[2025-11-29 17:53:00] [INFO] Caculating Latency, peak and mean
[2025-11-29 17:53:00] [INFO] Latency: 0.12, Peak: -4.483666221989814, Mean: -8.33581863291703
[2025-11-29 17:53:01] [INFO] ************************************************************
[2025-11-29 17:53:01] [INFO] **********P100 Pipeline sub-04, ses-01**********
[2025-11-29 17:53:01] [INFO] ************************************************************
[2025-11-29 17:53:01] [INFO] ************************************************************
[2025-11-29 17:53:01] [INFO] **********Initializing BIDSDatasetReader**********
[2025-11-29 17:53:01] [INFO] ************************************************************
[2025-11-29 17:53:01] [INFO] Processed EEG file exists. Loading...
[2025-11-29 17:53:01] [INFO] Loading processed EEG from BIDS/derivatives/low-0.1_high-40.0_ICA-True/sub-04_ses-01_processed.fif
[2025-11-29 17:53:02] [INFO] Creating epochs for condition: Visual
[2025-11-29 17:53:02] [INFO] ************************************************************
[2025-11-29 17:53:02] [INFO] **********Initializing Epoch Builder**********
[2025-11-29 17:53:02] [INFO] ************************************************************
[2025-11-29 17:53:02] [INFO] Creating Epochs
[2025-11-29 17:53:02] [INFO] Creating epochs for condition: No Visual Change
[2025-11-29 17:53:02] [INFO] ************************************************************
[2025-11-29 17:53:02] [INFO] **********Initializing Epoch Builder**********
[2025-11-29 17:53:02] [INFO] ************************************************************
[2025-11-29 17:53:02] [INFO] Creating Epochs
[2025-11-29 17:53:03] [INFO] ************************************************************
[2025-11-29 17:53:03] [INFO] **********Initializing P100ComponentAnalyzer**********
[2025-11-29 17:53:03] [INFO] ************************************************************
[2025-11-29 17:53:03] [INFO] Caculating Latency, peak and mean
[2025-11-29 17:53:03] [INFO] Latency: 0.12, Peak: 0.9068227205915391, Mean: -1.6348661320612443
[2025-11-29 17:53:03] [INFO] ************************************************************
[2025-11-29 17:53:03] [INFO] **********Initializing P100ComponentAnalyzer**********
[2025-11-29 17:53:03] [INFO] ************************************************************
[2025-11-29 17:53:03] [INFO] Caculating Latency, peak and mean
[2025-11-29 17:53:03] [INFO] Latency: 0.112, Peak: -0.05597034474123222, Mean: -0.18421603431932765
[2025-11-29 17:53:03] [INFO] ************************************************************
[2025-11-29 17:53:03] [INFO] **********P100 Pipeline sub-04, ses-02**********
[2025-11-29 17:53:03] [INFO] ************************************************************
[2025-11-29 17:53:03] [INFO] ************************************************************
[2025-11-29 17:53:03] [INFO] **********Initializing BIDSDatasetReader**********
[2025-11-29 17:53:03] [INFO] ************************************************************
[2025-11-29 17:53:03] [INFO] Processed EEG file exists. Loading...
[2025-11-29 17:53:03] [INFO] Loading processed EEG from BIDS/derivatives/low-0.1_high-40.0_ICA-True/sub-04_ses-02_processed.fif
[2025-11-29 17:53:04] [INFO] Creating epochs for condition: Visual
[2025-11-29 17:53:04] [INFO] ************************************************************
[2025-11-29 17:53:04] [INFO] **********Initializing Epoch Builder**********
[2025-11-29 17:53:04] [INFO] ************************************************************
[2025-11-29 17:53:04] [INFO] Creating Epochs
[2025-11-29 17:53:05] [INFO] Creating epochs for condition: No Visual Change
[2025-11-29 17:53:05] [INFO] ************************************************************
[2025-11-29 17:53:05] [INFO] **********Initializing Epoch Builder**********
[2025-11-29 17:53:05] [INFO] ************************************************************
[2025-11-29 17:53:05] [INFO] Creating Epochs
[2025-11-29 17:53:05] [INFO] ************************************************************
[2025-11-29 17:53:05] [INFO] **********Initializing P100ComponentAnalyzer**********
[2025-11-29 17:53:05] [INFO] ************************************************************
[2025-11-29 17:53:05] [INFO] Caculating Latency, peak and mean
[2025-11-29 17:53:05] [INFO] Latency: 0.12, Peak: 2.489422695481507, Mean: 0.35317901665466883
[2025-11-29 17:53:05] [INFO] ************************************************************
[2025-11-29 17:53:05] [INFO] **********Initializing P100ComponentAnalyzer**********
[2025-11-29 17:53:05] [INFO] ************************************************************
[2025-11-29 17:53:05] [INFO] Caculating Latency, peak and mean
[2025-11-29 17:53:05] [INFO] Latency: 0.12, Peak: -2.678904084049291, Mean: -3.259597593293339
[2025-11-29 17:53:05] [INFO] ************************************************************
[2025-11-29 17:53:05] [INFO] **********P100 Pipeline sub-05, ses-01**********
[2025-11-29 17:53:05] [INFO] ************************************************************
[2025-11-29 17:53:05] [INFO] ************************************************************
[2025-11-29 17:53:05] [INFO] **********Initializing BIDSDatasetReader**********
[2025-11-29 17:53:05] [INFO] ************************************************************
[2025-11-29 17:53:05] [INFO] Processed EEG file exists. Loading...
[2025-11-29 17:53:05] [INFO] Loading processed EEG from BIDS/derivatives/low-0.1_high-40.0_ICA-True/sub-05_ses-01_processed.fif
[2025-11-29 17:53:07] [INFO] Creating epochs for condition: Visual
[2025-11-29 17:53:07] [INFO] ************************************************************
[2025-11-29 17:53:07] [INFO] **********Initializing Epoch Builder**********
[2025-11-29 17:53:07] [INFO] ************************************************************
[2025-11-29 17:53:07] [INFO] Creating Epochs
[2025-11-29 17:53:07] [INFO] Creating epochs for condition: No Visual Change
[2025-11-29 17:53:07] [INFO] ************************************************************
[2025-11-29 17:53:07] [INFO] **********Initializing Epoch Builder**********
[2025-11-29 17:53:07] [INFO] ************************************************************
[2025-11-29 17:53:07] [INFO] Creating Epochs
[2025-11-29 17:53:07] [INFO] ************************************************************
[2025-11-29 17:53:07] [INFO] **********Initializing P100ComponentAnalyzer**********
[2025-11-29 17:53:07] [INFO] ************************************************************
[2025-11-29 17:53:07] [INFO] Caculating Latency, peak and mean
[2025-11-29 17:53:07] [INFO] Latency: 0.12, Peak: 1.4548729689496989, Mean: -0.8977157451482295
[2025-11-29 17:53:07] [INFO] ************************************************************
[2025-11-29 17:53:07] [INFO] **********Initializing P100ComponentAnalyzer**********
[2025-11-29 17:53:07] [INFO] ************************************************************
[2025-11-29 17:53:07] [INFO] Caculating Latency, peak and mean
[2025-11-29 17:53:07] [INFO] Latency: 0.12, Peak: -0.3907839557778166, Mean: -2.097879161204225
[2025-11-29 17:53:07] [INFO] ************************************************************
[2025-11-29 17:53:07] [INFO] **********P100 Pipeline sub-05, ses-02**********
[2025-11-29 17:53:07] [INFO] ************************************************************
[2025-11-29 17:53:07] [INFO] ************************************************************
[2025-11-29 17:53:07] [INFO] **********Initializing BIDSDatasetReader**********
[2025-11-29 17:53:07] [INFO] ************************************************************
[2025-11-29 17:53:07] [INFO] Processed EEG file exists. Loading...
[2025-11-29 17:53:07] [INFO] Loading processed EEG from BIDS/derivatives/low-0.1_high-40.0_ICA-True/sub-05_ses-02_processed.fif
[2025-11-29 17:53:09] [INFO] Creating epochs for condition: Visual
[2025-11-29 17:53:09] [INFO] ************************************************************
[2025-11-29 17:53:09] [INFO] **********Initializing Epoch Builder**********
[2025-11-29 17:53:09] [INFO] ************************************************************
[2025-11-29 17:53:09] [INFO] Creating Epochs
[2025-11-29 17:53:09] [INFO] Creating epochs for condition: No Visual Change
[2025-11-29 17:53:09] [INFO] ************************************************************
[2025-11-29 17:53:09] [INFO] **********Initializing Epoch Builder**********
[2025-11-29 17:53:09] [INFO] ************************************************************
[2025-11-29 17:53:09] [INFO] Creating Epochs
[2025-11-29 17:53:09] [INFO] ************************************************************
[2025-11-29 17:53:09] [INFO] **********Initializing P100ComponentAnalyzer**********
[2025-11-29 17:53:09] [INFO] ************************************************************
[2025-11-29 17:53:09] [INFO] Caculating Latency, peak and mean
[2025-11-29 17:53:09] [INFO] Latency: 0.091, Peak: 124.10730216679327, Mean: 116.95147278210075
[2025-11-29 17:53:09] [INFO] ************************************************************
[2025-11-29 17:53:09] [INFO] **********Initializing P100ComponentAnalyzer**********
[2025-11-29 17:53:09] [INFO] ************************************************************
[2025-11-29 17:53:09] [INFO] Caculating Latency, peak and mean
[2025-11-29 17:53:09] [INFO] Latency: 0.08, Peak: 2.9023828532565883, Mean: -4.838687724740947
[2025-11-29 17:53:09] [INFO] ************************************************************
[2025-11-29 17:53:09] [INFO] **********P100 Pipeline sub-06, ses-01**********
[2025-11-29 17:53:09] [INFO] ************************************************************
[2025-11-29 17:53:09] [INFO] ************************************************************
[2025-11-29 17:53:09] [INFO] **********Initializing BIDSDatasetReader**********
[2025-11-29 17:53:09] [INFO] ************************************************************
[2025-11-29 17:53:09] [INFO] Processed EEG file exists. Loading...
[2025-11-29 17:53:09] [INFO] Loading processed EEG from BIDS/derivatives/low-0.1_high-40.0_ICA-True/sub-06_ses-01_processed.fif
[2025-11-29 17:53:11] [INFO] Creating epochs for condition: Visual
[2025-11-29 17:53:11] [INFO] ************************************************************
[2025-11-29 17:53:11] [INFO] **********Initializing Epoch Builder**********
[2025-11-29 17:53:11] [INFO] ************************************************************
[2025-11-29 17:53:11] [INFO] Creating Epochs
[2025-11-29 17:53:11] [INFO] Creating epochs for condition: No Visual Change
[2025-11-29 17:53:11] [INFO] ************************************************************
[2025-11-29 17:53:11] [INFO] **********Initializing Epoch Builder**********
[2025-11-29 17:53:11] [INFO] ************************************************************
[2025-11-29 17:53:11] [INFO] Creating Epochs
[2025-11-29 17:53:11] [INFO] ************************************************************
[2025-11-29 17:53:11] [INFO] **********Initializing P100ComponentAnalyzer**********
[2025-11-29 17:53:11] [INFO] ************************************************************
[2025-11-29 17:53:11] [INFO] Caculating Latency, peak and mean
[2025-11-29 17:53:11] [INFO] Latency: 0.12, Peak: 8.482790376156938, Mean: 4.573106813677114
[2025-11-29 17:53:11] [INFO] ************************************************************
[2025-11-29 17:53:11] [INFO] **********Initializing P100ComponentAnalyzer**********
[2025-11-29 17:53:11] [INFO] ************************************************************
[2025-11-29 17:53:11] [INFO] Caculating Latency, peak and mean
[2025-11-29 17:53:11] [INFO] Latency: 0.12, Peak: -2.167250605799696, Mean: -2.9784850438063106
[2025-11-29 17:53:12] [INFO] ************************************************************
[2025-11-29 17:53:12] [INFO] **********P100 Pipeline sub-06, ses-02**********
[2025-11-29 17:53:12] [INFO] ************************************************************
[2025-11-29 17:53:12] [INFO] ************************************************************
[2025-11-29 17:53:12] [INFO] **********Initializing BIDSDatasetReader**********
[2025-11-29 17:53:12] [INFO] ************************************************************
[2025-11-29 17:53:12] [INFO] Processed EEG file exists. Loading...
[2025-11-29 17:53:12] [INFO] Loading processed EEG from BIDS/derivatives/low-0.1_high-40.0_ICA-True/sub-06_ses-02_processed.fif
[2025-11-29 17:53:13] [INFO] Creating epochs for condition: Visual
[2025-11-29 17:53:13] [INFO] ************************************************************
[2025-11-29 17:53:13] [INFO] **********Initializing Epoch Builder**********
[2025-11-29 17:53:13] [INFO] ************************************************************
[2025-11-29 17:53:13] [INFO] Creating Epochs
[2025-11-29 17:53:13] [INFO] Creating epochs for condition: No Visual Change
[2025-11-29 17:53:13] [INFO] ************************************************************
[2025-11-29 17:53:13] [INFO] **********Initializing Epoch Builder**********
[2025-11-29 17:53:13] [INFO] ************************************************************
[2025-11-29 17:53:13] [INFO] Creating Epochs
[2025-11-29 17:53:13] [INFO] ************************************************************
[2025-11-29 17:53:13] [INFO] **********Initializing P100ComponentAnalyzer**********
[2025-11-29 17:53:13] [INFO] ************************************************************
[2025-11-29 17:53:13] [INFO] Caculating Latency, peak and mean
[2025-11-29 17:53:13] [INFO] Latency: 0.12, Peak: 10.946130127686585, Mean: 4.90620911100447
[2025-11-29 17:53:13] [INFO] ************************************************************
[2025-11-29 17:53:13] [INFO] **********Initializing P100ComponentAnalyzer**********
[2025-11-29 17:53:13] [INFO] ************************************************************
[2025-11-29 17:53:14] [INFO] Caculating Latency, peak and mean
[2025-11-29 17:53:14] [INFO] Latency: 0.086, Peak: -0.011972231669824527, Mean: -0.5639563032512668
[2025-11-29 17:53:14] [INFO] ************************************************************
[2025-11-29 17:53:14] [INFO] **********P100 Pipeline sub-07, ses-01**********
[2025-11-29 17:53:14] [INFO] ************************************************************
[2025-11-29 17:53:14] [INFO] ************************************************************
[2025-11-29 17:53:14] [INFO] **********Initializing BIDSDatasetReader**********
[2025-11-29 17:53:14] [INFO] ************************************************************
[2025-11-29 17:53:14] [INFO] Processed EEG file exists. Loading...
[2025-11-29 17:53:14] [INFO] Loading processed EEG from BIDS/derivatives/low-0.1_high-40.0_ICA-True/sub-07_ses-01_processed.fif
[2025-11-29 17:53:15] [INFO] Creating epochs for condition: Visual
[2025-11-29 17:53:15] [INFO] ************************************************************
[2025-11-29 17:53:15] [INFO] **********Initializing Epoch Builder**********
[2025-11-29 17:53:15] [INFO] ************************************************************
[2025-11-29 17:53:15] [INFO] Creating Epochs
[2025-11-29 17:53:15] [INFO] Creating epochs for condition: No Visual Change
[2025-11-29 17:53:15] [INFO] ************************************************************
[2025-11-29 17:53:15] [INFO] **********Initializing Epoch Builder**********
[2025-11-29 17:53:15] [INFO] ************************************************************
[2025-11-29 17:53:15] [INFO] Creating Epochs
[2025-11-29 17:53:16] [INFO] ************************************************************
[2025-11-29 17:53:16] [INFO] **********Initializing P100ComponentAnalyzer**********
[2025-11-29 17:53:16] [INFO] ************************************************************
[2025-11-29 17:53:16] [INFO] Caculating Latency, peak and mean
[2025-11-29 17:53:16] [INFO] Latency: 0.096, Peak: 12.91476145667246, Mean: 2.707955847842127
[2025-11-29 17:53:16] [INFO] ************************************************************
[2025-11-29 17:53:16] [INFO] **********Initializing P100ComponentAnalyzer**********
[2025-11-29 17:53:16] [INFO] ************************************************************
[2025-11-29 17:53:16] [INFO] Caculating Latency, peak and mean
[2025-11-29 17:53:16] [INFO] Latency: 0.08, Peak: 35.76946591737379, Mean: 18.91652066246169
[2025-11-29 17:53:16] [INFO] ************************************************************
[2025-11-29 17:53:16] [INFO] **********P100 Pipeline sub-08, ses-01**********
[2025-11-29 17:53:16] [INFO] ************************************************************
[2025-11-29 17:53:16] [INFO] ************************************************************
[2025-11-29 17:53:16] [INFO] **********Initializing BIDSDatasetReader**********
[2025-11-29 17:53:16] [INFO] ************************************************************
[2025-11-29 17:53:16] [INFO] Processed EEG file exists. Loading...
[2025-11-29 17:53:16] [INFO] Loading processed EEG from BIDS/derivatives/low-0.1_high-40.0_ICA-True/sub-08_ses-01_processed.fif
[2025-11-29 17:53:17] [INFO] Creating epochs for condition: Visual
[2025-11-29 17:53:17] [INFO] ************************************************************
[2025-11-29 17:53:17] [INFO] **********Initializing Epoch Builder**********
[2025-11-29 17:53:17] [INFO] ************************************************************
[2025-11-29 17:53:18] [INFO] Creating Epochs
[2025-11-29 17:53:18] [INFO] Creating epochs for condition: No Visual Change
[2025-11-29 17:53:18] [INFO] ************************************************************
[2025-11-29 17:53:18] [INFO] **********Initializing Epoch Builder**********
[2025-11-29 17:53:18] [INFO] ************************************************************
[2025-11-29 17:53:18] [INFO] Creating Epochs
[2025-11-29 17:53:18] [INFO] ************************************************************
[2025-11-29 17:53:18] [INFO] **********Initializing P100ComponentAnalyzer**********
[2025-11-29 17:53:18] [INFO] ************************************************************
[2025-11-29 17:53:18] [INFO] Caculating Latency, peak and mean
[2025-11-29 17:53:18] [INFO] Latency: 0.12, Peak: 13.873740222671817, Mean: 7.702642989885534
[2025-11-29 17:53:18] [INFO] ************************************************************
[2025-11-29 17:53:18] [INFO] **********Initializing P100ComponentAnalyzer**********
[2025-11-29 17:53:18] [INFO] ************************************************************
[2025-11-29 17:53:18] [INFO] Caculating Latency, peak and mean
[2025-11-29 17:53:18] [INFO] Latency: 0.12, Peak: -0.6103348218179552, Mean: -2.315227069929271
[2025-11-29 17:53:18] [INFO] ************************************************************
[2025-11-29 17:53:18] [INFO] **********P100 Pipeline sub-09, ses-01**********
[2025-11-29 17:53:18] [INFO] ************************************************************
[2025-11-29 17:53:18] [INFO] ************************************************************
[2025-11-29 17:53:18] [INFO] **********Initializing BIDSDatasetReader**********
[2025-11-29 17:53:18] [INFO] ************************************************************
[2025-11-29 17:53:18] [INFO] Processed EEG file exists. Loading...
[2025-11-29 17:53:18] [INFO] Loading processed EEG from BIDS/derivatives/low-0.1_high-40.0_ICA-True/sub-09_ses-01_processed.fif
[2025-11-29 17:53:20] [INFO] Creating epochs for condition: Visual
[2025-11-29 17:53:20] [INFO] ************************************************************
[2025-11-29 17:53:20] [INFO] **********Initializing Epoch Builder**********
[2025-11-29 17:53:20] [INFO] ************************************************************
[2025-11-29 17:53:20] [INFO] Creating Epochs
[2025-11-29 17:53:20] [INFO] Creating epochs for condition: No Visual Change
[2025-11-29 17:53:20] [INFO] ************************************************************
[2025-11-29 17:53:20] [INFO] **********Initializing Epoch Builder**********
[2025-11-29 17:53:20] [INFO] ************************************************************
[2025-11-29 17:53:20] [INFO] Creating Epochs
[2025-11-29 17:53:20] [INFO] ************************************************************
[2025-11-29 17:53:20] [INFO] **********Initializing P100ComponentAnalyzer**********
[2025-11-29 17:53:20] [INFO] ************************************************************
[2025-11-29 17:53:20] [INFO] Caculating Latency, peak and mean
[2025-11-29 17:53:20] [INFO] Latency: 0.12, Peak: 7.6373643524227965, Mean: 1.687166742812706
[2025-11-29 17:53:20] [INFO] ************************************************************
[2025-11-29 17:53:20] [INFO] **********Initializing P100ComponentAnalyzer**********
[2025-11-29 17:53:20] [INFO] ************************************************************
[2025-11-29 17:53:20] [INFO] Caculating Latency, peak and mean
[2025-11-29 17:53:20] [INFO] Latency: 0.12, Peak: -3.304526830543446, Mean: -4.792034979665978
[2025-11-29 17:53:21] [INFO] ************************************************************
[2025-11-29 17:53:21] [INFO] **********P100 Pipeline sub-09, ses-02**********
[2025-11-29 17:53:21] [INFO] ************************************************************
[2025-11-29 17:53:21] [INFO] ************************************************************
[2025-11-29 17:53:21] [INFO] **********Initializing BIDSDatasetReader**********
[2025-11-29 17:53:21] [INFO] ************************************************************
[2025-11-29 17:53:21] [INFO] Processed EEG file exists. Loading...
[2025-11-29 17:53:21] [INFO] Loading processed EEG from BIDS/derivatives/low-0.1_high-40.0_ICA-True/sub-09_ses-02_processed.fif
[2025-11-29 17:53:22] [INFO] Creating epochs for condition: Visual
[2025-11-29 17:53:22] [INFO] ************************************************************
[2025-11-29 17:53:22] [INFO] **********Initializing Epoch Builder**********
[2025-11-29 17:53:22] [INFO] ************************************************************
[2025-11-29 17:53:22] [INFO] Creating Epochs
[2025-11-29 17:53:23] [INFO] Creating epochs for condition: No Visual Change
[2025-11-29 17:53:23] [INFO] ************************************************************
[2025-11-29 17:53:23] [INFO] **********Initializing Epoch Builder**********
[2025-11-29 17:53:23] [INFO] ************************************************************
[2025-11-29 17:53:23] [INFO] Creating Epochs
[2025-11-29 17:53:23] [INFO] ************************************************************
[2025-11-29 17:53:23] [INFO] **********Initializing P100ComponentAnalyzer**********
[2025-11-29 17:53:23] [INFO] ************************************************************
[2025-11-29 17:53:23] [INFO] Caculating Latency, peak and mean
[2025-11-29 17:53:23] [INFO] Latency: 0.12, Peak: 3.7496067408794747, Mean: 0.4395046134622371
[2025-11-29 17:53:23] [INFO] ************************************************************
[2025-11-29 17:53:23] [INFO] **********Initializing P100ComponentAnalyzer**********
[2025-11-29 17:53:23] [INFO] ************************************************************
[2025-11-29 17:53:23] [INFO] Caculating Latency, peak and mean
[2025-11-29 17:53:23] [INFO] Latency: 0.12, Peak: -3.1090735160972165, Mean: -4.8479022717951965
[2025-11-29 17:53:23] [INFO] ************************************************************
[2025-11-29 17:53:23] [INFO] **********P100 Pipeline sub-10, ses-01**********
[2025-11-29 17:53:23] [INFO] ************************************************************
[2025-11-29 17:53:23] [INFO] ************************************************************
[2025-11-29 17:53:23] [INFO] **********Initializing BIDSDatasetReader**********
[2025-11-29 17:53:23] [INFO] ************************************************************
[2025-11-29 17:53:23] [INFO] Processed EEG file exists. Loading...
[2025-11-29 17:53:23] [INFO] Loading processed EEG from BIDS/derivatives/low-0.1_high-40.0_ICA-True/sub-10_ses-01_processed.fif
[2025-11-29 17:53:25] [INFO] Creating epochs for condition: Visual
[2025-11-29 17:53:25] [INFO] ************************************************************
[2025-11-29 17:53:25] [INFO] **********Initializing Epoch Builder**********
[2025-11-29 17:53:25] [INFO] ************************************************************
[2025-11-29 17:53:25] [INFO] Creating Epochs
[2025-11-29 17:53:25] [INFO] Creating epochs for condition: No Visual Change
[2025-11-29 17:53:25] [INFO] ************************************************************
[2025-11-29 17:53:25] [INFO] **********Initializing Epoch Builder**********
[2025-11-29 17:53:25] [INFO] ************************************************************
[2025-11-29 17:53:25] [INFO] Creating Epochs
[2025-11-29 17:53:26] [INFO] ************************************************************
[2025-11-29 17:53:26] [INFO] **********Initializing P100ComponentAnalyzer**********
[2025-11-29 17:53:26] [INFO] ************************************************************
[2025-11-29 17:53:26] [INFO] Caculating Latency, peak and mean
[2025-11-29 17:53:26] [INFO] Latency: 0.12, Peak: 8.552654403100368, Mean: 3.6574665279059864
[2025-11-29 17:53:26] [INFO] ************************************************************
[2025-11-29 17:53:26] [INFO] **********Initializing P100ComponentAnalyzer**********
[2025-11-29 17:53:26] [INFO] ************************************************************
[2025-11-29 17:53:26] [INFO] Caculating Latency, peak and mean
[2025-11-29 17:53:26] [INFO] Latency: 0.12, Peak: -0.38438913198868024, Mean: -1.9901520958340997
[2025-11-29 17:53:26] [INFO] ************************************************************
[2025-11-29 17:53:26] [INFO] **********P100 Pipeline sub-11, ses-01**********
[2025-11-29 17:53:26] [INFO] ************************************************************
[2025-11-29 17:53:26] [INFO] ************************************************************
[2025-11-29 17:53:26] [INFO] **********Initializing BIDSDatasetReader**********
[2025-11-29 17:53:26] [INFO] ************************************************************
[2025-11-29 17:53:26] [INFO] Processed EEG file exists. Loading...
[2025-11-29 17:53:26] [INFO] Loading processed EEG from BIDS/derivatives/low-0.1_high-40.0_ICA-True/sub-11_ses-01_processed.fif
[2025-11-29 17:53:28] [INFO] Creating epochs for condition: Visual
[2025-11-29 17:53:28] [INFO] ************************************************************
[2025-11-29 17:53:28] [INFO] **********Initializing Epoch Builder**********
[2025-11-29 17:53:28] [INFO] ************************************************************
[2025-11-29 17:53:28] [INFO] Creating Epochs
[2025-11-29 17:53:29] [INFO] Creating epochs for condition: No Visual Change
[2025-11-29 17:53:29] [INFO] ************************************************************
[2025-11-29 17:53:29] [INFO] **********Initializing Epoch Builder**********
[2025-11-29 17:53:29] [INFO] ************************************************************
[2025-11-29 17:53:29] [INFO] Creating Epochs
[2025-11-29 17:53:29] [INFO] ************************************************************
[2025-11-29 17:53:29] [INFO] **********Initializing P100ComponentAnalyzer**********
[2025-11-29 17:53:29] [INFO] ************************************************************
[2025-11-29 17:53:29] [INFO] Caculating Latency, peak and mean
[2025-11-29 17:53:29] [INFO] Latency: 0.088, Peak: 2.1927522896209215, Mean: 1.124073516451681
[2025-11-29 17:53:29] [INFO] ************************************************************
[2025-11-29 17:53:29] [INFO] **********Initializing P100ComponentAnalyzer**********
[2025-11-29 17:53:29] [INFO] ************************************************************
[2025-11-29 17:53:29] [INFO] Caculating Latency, peak and mean
[2025-11-29 17:53:29] [INFO] Latency: 0.12, Peak: 0.6103548830358819, Mean: -0.0674770566984814
[2025-11-29 17:53:29] [INFO] ************************************************************
[2025-11-29 17:53:29] [INFO] **********P100 Pipeline sub-12, ses-01**********
[2025-11-29 17:53:29] [INFO] ************************************************************
[2025-11-29 17:53:29] [INFO] ************************************************************
[2025-11-29 17:53:29] [INFO] **********Initializing BIDSDatasetReader**********
[2025-11-29 17:53:29] [INFO] ************************************************************
[2025-11-29 17:53:29] [INFO] Processed EEG file exists. Loading...
[2025-11-29 17:53:29] [INFO] Loading processed EEG from BIDS/derivatives/low-0.1_high-40.0_ICA-True/sub-12_ses-01_processed.fif
[2025-11-29 17:53:32] [INFO] Creating epochs for condition: Visual
[2025-11-29 17:53:32] [INFO] ************************************************************
[2025-11-29 17:53:32] [INFO] **********Initializing Epoch Builder**********
[2025-11-29 17:53:32] [INFO] ************************************************************
[2025-11-29 17:53:32] [INFO] Creating Epochs
[2025-11-29 17:53:32] [INFO] Creating epochs for condition: No Visual Change
[2025-11-29 17:53:32] [INFO] ************************************************************
[2025-11-29 17:53:32] [INFO] **********Initializing Epoch Builder**********
[2025-11-29 17:53:32] [INFO] ************************************************************
[2025-11-29 17:53:32] [INFO] Creating Epochs
[2025-11-29 17:53:32] [INFO] ************************************************************
[2025-11-29 17:53:32] [INFO] **********Initializing P100ComponentAnalyzer**********
[2025-11-29 17:53:32] [INFO] ************************************************************
[2025-11-29 17:53:32] [INFO] Caculating Latency, peak and mean
[2025-11-29 17:53:32] [INFO] Latency: 0.12, Peak: 3.0304036506936276, Mean: 0.9455387066676633
[2025-11-29 17:53:32] [INFO] ************************************************************
[2025-11-29 17:53:32] [INFO] **********Initializing P100ComponentAnalyzer**********
[2025-11-29 17:53:32] [INFO] ************************************************************
[2025-11-29 17:53:32] [INFO] Caculating Latency, peak and mean
[2025-11-29 17:53:32] [INFO] Latency: 0.12, Peak: -1.4267259679075164, Mean: -2.939773999053841
[2025-11-29 17:53:32] [INFO] ************************************************************
[2025-11-29 17:53:32] [INFO] **********P100 Pipeline sub-12, ses-02**********
[2025-11-29 17:53:32] [INFO] ************************************************************
[2025-11-29 17:53:32] [INFO] ************************************************************
[2025-11-29 17:53:32] [INFO] **********Initializing BIDSDatasetReader**********
[2025-11-29 17:53:32] [INFO] ************************************************************
[2025-11-29 17:53:32] [INFO] Processed EEG file exists. Loading...
[2025-11-29 17:53:32] [INFO] Loading processed EEG from BIDS/derivatives/low-0.1_high-40.0_ICA-True/sub-12_ses-02_processed.fif
[2025-11-29 17:53:35] [INFO] Creating epochs for condition: Visual
[2025-11-29 17:53:35] [INFO] ************************************************************
[2025-11-29 17:53:35] [INFO] **********Initializing Epoch Builder**********
[2025-11-29 17:53:35] [INFO] ************************************************************
[2025-11-29 17:53:35] [INFO] Creating Epochs
[2025-11-29 17:53:35] [INFO] Creating epochs for condition: No Visual Change
[2025-11-29 17:53:35] [INFO] ************************************************************
[2025-11-29 17:53:35] [INFO] **********Initializing Epoch Builder**********
[2025-11-29 17:53:35] [INFO] ************************************************************
[2025-11-29 17:53:35] [INFO] Creating Epochs
[2025-11-29 17:53:36] [INFO] ************************************************************
[2025-11-29 17:53:36] [INFO] **********Initializing P100ComponentAnalyzer**********
[2025-11-29 17:53:36] [INFO] ************************************************************
[2025-11-29 17:53:36] [INFO] Caculating Latency, peak and mean
[2025-11-29 17:53:36] [INFO] Latency: 0.116, Peak: 5.556277425437019, Mean: 2.6473811624983763
[2025-11-29 17:53:36] [INFO] ************************************************************
[2025-11-29 17:53:36] [INFO] **********Initializing P100ComponentAnalyzer**********
[2025-11-29 17:53:36] [INFO] ************************************************************
[2025-11-29 17:53:36] [INFO] Caculating Latency, peak and mean
[2025-11-29 17:53:36] [INFO] Latency: 0.12, Peak: -0.4946219306265394, Mean: -2.2177796421181633
[2025-11-29 17:53:36] [INFO] ************************************************************
[2025-11-29 17:53:36] [INFO] **********P100 Pipeline sub-13, ses-01**********
[2025-11-29 17:53:36] [INFO] ************************************************************
[2025-11-29 17:53:36] [INFO] ************************************************************
[2025-11-29 17:53:36] [INFO] **********Initializing BIDSDatasetReader**********
[2025-11-29 17:53:36] [INFO] ************************************************************
[2025-11-29 17:53:36] [INFO] Processed EEG file exists. Loading...
[2025-11-29 17:53:36] [INFO] Loading processed EEG from BIDS/derivatives/low-0.1_high-40.0_ICA-True/sub-13_ses-01_processed.fif
[2025-11-29 17:53:39] [INFO] Creating epochs for condition: Visual
[2025-11-29 17:53:39] [INFO] ************************************************************
[2025-11-29 17:53:39] [INFO] **********Initializing Epoch Builder**********
[2025-11-29 17:53:39] [INFO] ************************************************************
[2025-11-29 17:53:39] [INFO] Creating Epochs
[2025-11-29 17:53:39] [INFO] Creating epochs for condition: No Visual Change
[2025-11-29 17:53:39] [INFO] ************************************************************
[2025-11-29 17:53:39] [INFO] **********Initializing Epoch Builder**********
[2025-11-29 17:53:39] [INFO] ************************************************************
[2025-11-29 17:53:39] [INFO] Creating Epochs
[2025-11-29 17:53:39] [INFO] ************************************************************
[2025-11-29 17:53:39] [INFO] **********Initializing P100ComponentAnalyzer**********
[2025-11-29 17:53:39] [INFO] ************************************************************
[2025-11-29 17:53:39] [INFO] Caculating Latency, peak and mean
[2025-11-29 17:53:39] [INFO] Latency: 0.12, Peak: 14.070555987561184, Mean: 4.114491763550066
[2025-11-29 17:53:39] [INFO] ************************************************************
[2025-11-29 17:53:39] [INFO] **********Initializing P100ComponentAnalyzer**********
[2025-11-29 17:53:39] [INFO] ************************************************************
[2025-11-29 17:53:39] [INFO] Caculating Latency, peak and mean
[2025-11-29 17:53:39] [INFO] Latency: 0.12, Peak: 1.3076999205528106, Mean: -1.5792760812420914
[2025-11-29 17:53:39] [INFO] ************************************************************
[2025-11-29 17:53:39] [INFO] **********P100 Pipeline sub-13, ses-02**********
[2025-11-29 17:53:39] [INFO] ************************************************************
[2025-11-29 17:53:39] [INFO] ************************************************************
[2025-11-29 17:53:39] [INFO] **********Initializing BIDSDatasetReader**********
[2025-11-29 17:53:39] [INFO] ************************************************************
[2025-11-29 17:53:39] [INFO] Processed EEG file exists. Loading...
[2025-11-29 17:53:39] [INFO] Loading processed EEG from BIDS/derivatives/low-0.1_high-40.0_ICA-True/sub-13_ses-02_processed.fif
[2025-11-29 17:53:42] [INFO] Creating epochs for condition: Visual
[2025-11-29 17:53:42] [INFO] ************************************************************
[2025-11-29 17:53:42] [INFO] **********Initializing Epoch Builder**********
[2025-11-29 17:53:42] [INFO] ************************************************************
[2025-11-29 17:53:42] [INFO] Creating Epochs
[2025-11-29 17:53:42] [INFO] Creating epochs for condition: No Visual Change
[2025-11-29 17:53:42] [INFO] ************************************************************
[2025-11-29 17:53:42] [INFO] **********Initializing Epoch Builder**********
[2025-11-29 17:53:42] [INFO] ************************************************************
[2025-11-29 17:53:42] [INFO] Creating Epochs
[2025-11-29 17:53:43] [INFO] ************************************************************
[2025-11-29 17:53:43] [INFO] **********Initializing P100ComponentAnalyzer**********
[2025-11-29 17:53:43] [INFO] ************************************************************
[2025-11-29 17:53:43] [INFO] Caculating Latency, peak and mean
[2025-11-29 17:53:43] [INFO] Latency: 0.12, Peak: 14.098103724706318, Mean: 4.440508860798474
[2025-11-29 17:53:43] [INFO] ************************************************************
[2025-11-29 17:53:43] [INFO] **********Initializing P100ComponentAnalyzer**********
[2025-11-29 17:53:43] [INFO] ************************************************************
[2025-11-29 17:53:43] [INFO] Caculating Latency, peak and mean
[2025-11-29 17:53:43] [INFO] Latency: 0.12, Peak: 1.4360069258323647, Mean: -2.8469638844869287
[2025-11-29 17:53:43] [INFO] ************************************************************
[2025-11-29 17:53:43] [INFO] **********P100 Pipeline sub-14, ses-01**********
[2025-11-29 17:53:43] [INFO] ************************************************************
[2025-11-29 17:53:43] [INFO] ************************************************************
[2025-11-29 17:53:43] [INFO] **********Initializing BIDSDatasetReader**********
[2025-11-29 17:53:43] [INFO] ************************************************************
[2025-11-29 17:53:43] [INFO] Processed EEG file exists. Loading...
[2025-11-29 17:53:43] [INFO] Loading processed EEG from BIDS/derivatives/low-0.1_high-40.0_ICA-True/sub-14_ses-01_processed.fif
[2025-11-29 17:53:46] [INFO] Creating epochs for condition: Visual
[2025-11-29 17:53:46] [INFO] ************************************************************
[2025-11-29 17:53:46] [INFO] **********Initializing Epoch Builder**********
[2025-11-29 17:53:46] [INFO] ************************************************************
[2025-11-29 17:53:46] [INFO] Creating Epochs
[2025-11-29 17:53:46] [INFO] Creating epochs for condition: No Visual Change
[2025-11-29 17:53:46] [INFO] ************************************************************
[2025-11-29 17:53:46] [INFO] **********Initializing Epoch Builder**********
[2025-11-29 17:53:46] [INFO] ************************************************************
[2025-11-29 17:53:46] [INFO] Creating Epochs
[2025-11-29 17:53:46] [INFO] ************************************************************
[2025-11-29 17:53:46] [INFO] **********Initializing P100ComponentAnalyzer**********
[2025-11-29 17:53:46] [INFO] ************************************************************
[2025-11-29 17:53:47] [INFO] Caculating Latency, peak and mean
[2025-11-29 17:53:47] [INFO] Latency: 0.12, Peak: 4.9754546100171515, Mean: -0.5781266605214295
[2025-11-29 17:53:47] [INFO] ************************************************************
[2025-11-29 17:53:47] [INFO] **********Initializing P100ComponentAnalyzer**********
[2025-11-29 17:53:47] [INFO] ************************************************************
[2025-11-29 17:53:47] [INFO] Caculating Latency, peak and mean
[2025-11-29 17:53:47] [INFO] Latency: 0.097, Peak: -2.6461240966065396, Mean: -2.9514997419953497
[2025-11-29 17:53:47] [INFO] ************************************************************
[2025-11-29 17:53:47] [INFO] **********P100 Pipeline sub-15, ses-01**********
[2025-11-29 17:53:47] [INFO] ************************************************************
[2025-11-29 17:53:47] [INFO] ************************************************************
[2025-11-29 17:53:47] [INFO] **********Initializing BIDSDatasetReader**********
[2025-11-29 17:53:47] [INFO] ************************************************************
[2025-11-29 17:53:47] [INFO] Processed EEG file exists. Loading...
[2025-11-29 17:53:47] [INFO] Loading processed EEG from BIDS/derivatives/low-0.1_high-40.0_ICA-True/sub-15_ses-01_processed.fif
[2025-11-29 17:53:49] [INFO] Creating epochs for condition: Visual
[2025-11-29 17:53:49] [INFO] ************************************************************
[2025-11-29 17:53:49] [INFO] **********Initializing Epoch Builder**********
[2025-11-29 17:53:49] [INFO] ************************************************************
[2025-11-29 17:53:49] [INFO] Creating Epochs
[2025-11-29 17:53:49] [INFO] Creating epochs for condition: No Visual Change
[2025-11-29 17:53:49] [INFO] ************************************************************
[2025-11-29 17:53:49] [INFO] **********Initializing Epoch Builder**********
[2025-11-29 17:53:49] [INFO] ************************************************************
[2025-11-29 17:53:49] [INFO] Creating Epochs
[2025-11-29 17:53:49] [INFO] ************************************************************
[2025-11-29 17:53:49] [INFO] **********Initializing P100ComponentAnalyzer**********
[2025-11-29 17:53:49] [INFO] ************************************************************
[2025-11-29 17:53:49] [INFO] Caculating Latency, peak and mean
[2025-11-29 17:53:49] [INFO] Latency: 0.12, Peak: 2.369918675794891, Mean: -0.9225581378563263
[2025-11-29 17:53:49] [INFO] ************************************************************
[2025-11-29 17:53:49] [INFO] **********Initializing P100ComponentAnalyzer**********
[2025-11-29 17:53:49] [INFO] ************************************************************
[2025-11-29 17:53:49] [INFO] Caculating Latency, peak and mean
[2025-11-29 17:53:49] [INFO] Latency: 0.107, Peak: 0.1304073684127891, Mean: -0.33193677919967
[2025-11-29 17:53:49] [INFO] ************************************************************
[2025-11-29 17:53:49] [INFO] **********P100 Pipeline sub-15, ses-02**********
[2025-11-29 17:53:49] [INFO] ************************************************************
[2025-11-29 17:53:49] [INFO] ************************************************************
[2025-11-29 17:53:49] [INFO] **********Initializing BIDSDatasetReader**********
[2025-11-29 17:53:49] [INFO] ************************************************************
[2025-11-29 17:53:49] [INFO] Processed EEG file exists. Loading...
[2025-11-29 17:53:49] [INFO] Loading processed EEG from BIDS/derivatives/low-0.1_high-40.0_ICA-True/sub-15_ses-02_processed.fif
[2025-11-29 17:53:50] [INFO] Creating epochs for condition: Visual
[2025-11-29 17:53:50] [INFO] ************************************************************
[2025-11-29 17:53:50] [INFO] **********Initializing Epoch Builder**********
[2025-11-29 17:53:50] [INFO] ************************************************************
[2025-11-29 17:53:50] [INFO] Creating Epochs
[2025-11-29 17:53:50] [INFO] Creating epochs for condition: No Visual Change
[2025-11-29 17:53:50] [INFO] ************************************************************
[2025-11-29 17:53:50] [INFO] **********Initializing Epoch Builder**********
[2025-11-29 17:53:50] [INFO] ************************************************************
[2025-11-29 17:53:50] [INFO] Creating Epochs
[2025-11-29 17:53:50] [INFO] ************************************************************
[2025-11-29 17:53:50] [INFO] **********Initializing P100ComponentAnalyzer**********
[2025-11-29 17:53:50] [INFO] ************************************************************
[2025-11-29 17:53:50] [INFO] Caculating Latency, peak and mean
[2025-11-29 17:53:50] [INFO] Latency: 0.12, Peak: 2.611171460884108, Mean: -1.1776352922577624
[2025-11-29 17:53:50] [INFO] ************************************************************
[2025-11-29 17:53:50] [INFO] **********Initializing P100ComponentAnalyzer**********
[2025-11-29 17:53:50] [INFO] ************************************************************
[2025-11-29 17:53:50] [INFO] Caculating Latency, peak and mean
[2025-11-29 17:53:50] [INFO] Latency: 0.098, Peak: -1.1238309782799663, Mean: -1.3631174477992274
[2025-11-29 17:53:50] [INFO] Completed Grand ERP Rest Visualization
[2025-11-29 17:53:50] [INFO] Grand ERP plot saved at: results/images/grand_erp_rest_visual.pdf
[2025-11-29 17:53:50] [INFO] Plotting accuracy plot
[2025-11-29 17:53:50] [INFO]    subject_id  accuracy
0          01  0.761438
1          02  0.565359
2          03  0.849673
3          04  0.779412
4          05  0.735294
5          06  0.758170
6          07  0.545752
7          08  0.807190
8          09  0.730392
9          10  0.660131
10         11  0.702614
11         12  0.750000
12         13  0.772876
13         14  0.813725
14         15  0.806404
[2025-11-29 17:53:50] [INFO]         accuracy
count  15.000000
mean    0.735895
std     0.086924
min     0.545752
25%     0.716503
50%     0.758170
75%     0.792908
max     0.849673
[2025-11-29 17:53:50] [INFO] Plotting confusion matrix
[2025-11-29 17:53:51] [INFO] Confusion matrix plot saved to results/images/cm.png
[2025-11-29 17:53:51] [INFO] Confusion matrix data:
        Overt  Covert  Rest
Overt    1918     163   113
Covert    218    1733   244
Rest      340     622  1233
[2025-11-29 17:53:51] [INFO] Plotting metrics
[2025-11-29 17:53:51] [INFO] Metrics plot saved to results/images/overt_covert_rest_metrics.pdf
[2025-11-29 17:53:51] [INFO] Metrics summary per subject:
   subject_id  precision    recall        f1
0          01   0.835320  0.761438  0.734893
1          02   0.647195  0.565359  0.558331
2          03   0.862378  0.849673  0.845757
3          04   0.817008  0.779412  0.770917
4          05   0.746934  0.735294  0.732353
5          06   0.758285  0.758170  0.753551
6          07   0.553001  0.545752  0.539813
7          08   0.829866  0.807190  0.807960
8          09   0.733758  0.730392  0.731000
9          10   0.684718  0.660131  0.644908
10         11   0.702707  0.702614  0.693793
11         12   0.787174  0.750000  0.734394
12         13   0.803208  0.772876  0.760521
13         14   0.817121  0.813725  0.814186
14         15   0.838887  0.806404  0.801630
[2025-11-29 17:53:51] [INFO] Class-wise precision:
class_id
0    0.798960
1    0.706437
2    0.799540
Name: precision, dtype: float64
[2025-11-29 17:53:51] [INFO] Class-wise recall:
class_id
0    0.875291
1    0.789998
2    0.567181
Name: recall, dtype: float64
[2025-11-29 17:53:51] [INFO] Class-wise F1 score:
class_id
0    0.828454
1    0.734290
2    0.647524
Name: f1, dtype: float64
[2025-11-29 17:53:51] [INFO] Class-wise precision standard deviation:
class_id
0    0.141413
1    0.094134
2    0.147519
Name: precision, dtype: float64
[2025-11-29 17:53:51] [INFO] Class-wise recall standard deviation:
class_id
0    0.113485
1    0.150644
2    0.160616
Name: recall, dtype: float64
[2025-11-29 17:53:51] [INFO] Class-wise F1 score standard deviation:
class_id
0    0.116297
1    0.085515
2    0.125906
Name: f1, dtype: float64
